{
  "metadata": {
    "name": "Assamese-Roman Deori Orthography Mapping",
    "version": "1.0.0",
    "source": {
      "author": "Deori Sahitya Sabha & Brown (1895)",
      "year": 2014,
      "title": "Community Orthography and Historical Grammars",
      "license": "CC BY-SA 4.0"
    },
    "description": "Bidirectional mapping between Assamese script and Roman orthographies (Community Roman with 'cch' and Brown 1895 with macrons)"
  },
  "vowels": {
    "independent": {
      "অ": "o",
      "আ": "a",
      "ই": "i",
      "ঈ": "i",
      "উ": "u",
      "ঊ": "u",
      "এ": "e",
      "ঐ": "oi",
      "ও": "o",
      "ঔ": "ou"
    },
    "dependent": {
      "া": "a",
      "ি": "i",
      "ী": "i",
      "ু": "u",
      "ূ": "u",
      "ে": "e",
      "ৈ": "oi",
      "ো": "o",
      "ৌ": "ou"
    }
  },
  "consonants": {
    "ক": "k",
    "খ": "kh",
    "গ": "g",
    "ঘ": "gh",
    "ঙ": "ng",
    "চ": "ch",
    "ছ": "ch",
    "চ্চ": "cch",
    "চ্ছ": "cch",
    "জ": "j",
    "ঝ": "jh",
    "ঞ": "ny",
    "ট": "t",
    "ঠ": "th",
    "ড": "d",
    "ঢ": "dh",
    "ণ": "n",
    "ত": "t",
    "থ": "th",
    "দ": "d",
    "ধ": "dh",
    "ন": "n",
    "প": "p",
    "ফ": "ph",
    "ব": "b",
    "ভ": "bh",
    "ম": "m",
    "য": "z",
    "ৰ": "r",
    "ল": "l",
    "ৱ": "w",
    "শ": "s",
    "ষ": "s",
    "স": "s",
    "হ": "h",
    "ক্ষ": "kkhya",
    "ড়": "r",
    "ঢ়": "rh",
    "য়": "y"
  },
  "signs": {
    "ঁ": "~",
    "ং": "ng",
    "ঃ": "h"
  },
  "roman_to_assamese": {
    "cch": "চ্চ",
    "kh": "খ",
    "gh": "ঘ",
    "ng": "ঙ",
    "ch": "চ",
    "jh": "ঝ",
    "ny": "ঞ",
    "th": "থ",
    "dh": "ধ",
    "ph": "ফ",
    "bh": "ভ",
    "sh": "শ",
    "rh": "ঢ়",
    "k": "ক",
    "g": "গ",
    "j": "জ",
    "t": "ত",
    "d": "দ",
    "n": "ন",
    "p": "প",
    "b": "ব",
    "m": "ম",
    "y": "য",
    "r": "ৰ",
    "l": "ল",
    "w": "ৱ",
    "v": "ৱ",
    "s": "স",
    "h": "হ",
    "z": "জ"
  }
}
